{
  "id": "65a7c1f2d4e5f60718293a4b-0",
  "content": "CONTRAT DE TRAVAIL, EXECUTION > Salaire\nIl résulte de l'article L. 3121-1 du code du travail que le temps de trajet n'est pas du temps de travail effectif.",
  "metadata": {
    "id": "65a7c1f2d4e5f60718293a4b-0",
    "source": "judilibre",
    "title": "CONTRAT DE TRAVAIL, EXECUTION,Salaire",
    "url": "https://www.courdecassation.fr/decision/65a7c1f2d4e5f60718293a4b",
    "idcc": null,
    "idx": 0,
    "initial_id": "65a7c1f2d4e5f60718293a4b",
    "articles": [],
    "number": "22-12.345",
    "decision_date": "2024-01-17"
  },
  "doc_hash": "10f056527823ebd16dd51b015f647fbb6f3b58d8b5bf2ad9a84e9f39421623a5",
  "embed_hash": "93f6e51f3d8435fb172b0f4a824ef22b3a10a8d9b3505a5fe7316d6cfee15cfb",
  "embedding": [
    0.1,
    0.2,
    0.3
  ]
}
