{
  "id": "KALIARTI0000000014861",
  "content": "Texte de base > Convention collective nationale du 15 décembre 1987 > Titre Ier : Dispositions générales — Article 1\nLa présente convention règle les rapports entre employeurs et salariés.",
  "metadata": {
    "id": "KALIARTI0000000014861",
    "source": "conventions",
    "title": "Titre Ier : Dispositions générales — Article 1",
    "url": "https://www.legifrance.gouv.fr/conv_coll/id/KALIARTI0000000014861",
    "idcc": "1486",
    "idx": 0,
    "initial_id": "KALIARTI0000000014861",
    "articles": []
  },
  "doc_hash": "c2c09afca5548f82eb8c950ea41ce62ba2156c34815c210d1d96647903eb3d5b",
  "embed_hash": "4a0629a4f8e9bf5d59a8d0c7780630d473a063d6e2a3868af61037e9443a7115",
  "embedding": [
    0.1,
    0.2,
    0.3
  ]
}
